{
  "schema": "adu-executable-geometry/1",
  "profile_id": "adu-a-600-profile-owner-adopted",
  "profile_version": "1.0.0",
  "adoption_state": "owner_adopted",
  "maturity": "concept_only",
  "model_binding": {
    "model_id": "adu-a-600",
    "model_version": "1.0.0",
    "release_version": "2026.09.0",
    "release_digest": "sha256:a2fca45a44d35a1a3201e581f68cded217848fcc4eab70be9ff35eb81ec584ab",
    "geometry_source_ref": "models/geometry/adu-a-600@1",
    "geometry_source_digest": "sha256:802fd8b26974995d1fadf2a0b51f436a0efac5a95181cc7a8fd25a25c54f1a35",
    "reference_configuration": {
      "footprint_width_ft": 20,
      "footprint_depth_ft": 30,
      "layout_variant": "open",
      "entry_side": "front",
      "orientation_deg": 0,
      "roof_form": "gable",
      "window_package": "standard",
      "exterior_finish": "stucco-smooth",
      "exterior_palette": "warm-white",
      "interior_tier": "essential"
    },
    "reference_configuration_digest": "sha256:dfda43d190c10c8944d6ee779d0bad65292c7e6e9db96051ea6ab4186af3c91b"
  },
  "provenance": {
    "origin": "west_coast_kbp_original",
    "author": "West Coast KBP",
    "creation_record": "docs/shared-briefs/GEOMETRY-PROGRAM-001/OUTCOME.md",
    "attestation": "Exact q16 transcription of the Owner-adopted A600 product basis from the reviewed SVG. D08 assembly thickness and junction solids remain unresolved; no municipal, third-party, copied, professional, permit, code, site, commercial, or construction truth is asserted.",
    "design_input_evidence_refs": [
      "docs/design/a600/A600-CONCEPT-TESTFIT-001.svg@085353bf0f7d3bec86eb7c9a46977bde9f822d9a",
      "sha256:54cb40a6212916d83ab5638ae05330d113a06dc9c09a03fe5f120875f03da5f4",
      "https://github.com/WEST-COAST-KBP-ADU/construction-os/issues/115#issuecomment-5234465734",
      "https://github.com/WEST-COAST-KBP-ADU/construction-os/issues/115#issuecomment-5234481099"
    ],
    "municipal_source_used": false,
    "third_party_geometry_used": false,
    "copied_plan_geometry_used": false
  },
  "units": {
    "length": "q16_in",
    "area": "q16sq"
  },
  "precision": {
    "length_quantum_q16": 1,
    "coordinate_bound_q16": 1000000
  },
  "coordinate_frame": {
    "origin": "front_left_exterior_wall_corner",
    "x_axis": "right",
    "y_axis": "rear",
    "z_axis": "up",
    "handedness": "right",
    "canonical_orientation": 0
  },
  "levels": [
    {
      "level_id": "level-0",
      "authored_order": 0,
      "floor_z_q16": 0,
      "ceiling_z_q16": 1728
    }
  ],
  "plan_vertices": [
    {
      "vertex_id": "v-x0-y0",
      "authored_order": 0,
      "level_id": "level-0",
      "x_q16": 0,
      "y_q16": 0
    },
    {
      "vertex_id": "v-x3072-y0",
      "authored_order": 1,
      "level_id": "level-0",
      "x_q16": 3072,
      "y_q16": 0
    },
    {
      "vertex_id": "v-x3840-y0",
      "authored_order": 2,
      "level_id": "level-0",
      "x_q16": 3840,
      "y_q16": 0
    },
    {
      "vertex_id": "v-x3840-y1152",
      "authored_order": 3,
      "level_id": "level-0",
      "x_q16": 3840,
      "y_q16": 1152
    },
    {
      "vertex_id": "v-x3072-y1152",
      "authored_order": 4,
      "level_id": "level-0",
      "x_q16": 3072,
      "y_q16": 1152
    },
    {
      "vertex_id": "v-x0-y1728",
      "authored_order": 5,
      "level_id": "level-0",
      "x_q16": 0,
      "y_q16": 1728
    },
    {
      "vertex_id": "v-x1792-y1728",
      "authored_order": 6,
      "level_id": "level-0",
      "x_q16": 1792,
      "y_q16": 1728
    },
    {
      "vertex_id": "v-x3072-y1728",
      "authored_order": 7,
      "level_id": "level-0",
      "x_q16": 3072,
      "y_q16": 1728
    },
    {
      "vertex_id": "v-x0-y3456",
      "authored_order": 8,
      "level_id": "level-0",
      "x_q16": 0,
      "y_q16": 3456
    },
    {
      "vertex_id": "v-x1792-y3456",
      "authored_order": 9,
      "level_id": "level-0",
      "x_q16": 1792,
      "y_q16": 3456
    },
    {
      "vertex_id": "v-x3072-y3456",
      "authored_order": 10,
      "level_id": "level-0",
      "x_q16": 3072,
      "y_q16": 3456
    },
    {
      "vertex_id": "v-x3840-y3456",
      "authored_order": 11,
      "level_id": "level-0",
      "x_q16": 3840,
      "y_q16": 3456
    },
    {
      "vertex_id": "v-x3072-y4032",
      "authored_order": 12,
      "level_id": "level-0",
      "x_q16": 3072,
      "y_q16": 4032
    },
    {
      "vertex_id": "v-x3840-y4032",
      "authored_order": 13,
      "level_id": "level-0",
      "x_q16": 3840,
      "y_q16": 4032
    },
    {
      "vertex_id": "v-x3840-y5760",
      "authored_order": 14,
      "level_id": "level-0",
      "x_q16": 3840,
      "y_q16": 5760
    },
    {
      "vertex_id": "v-x3072-y5760",
      "authored_order": 15,
      "level_id": "level-0",
      "x_q16": 3072,
      "y_q16": 5760
    },
    {
      "vertex_id": "v-x0-y5760",
      "authored_order": 16,
      "level_id": "level-0",
      "x_q16": 0,
      "y_q16": 5760
    }
  ],
  "gross_envelopes": [
    {
      "envelope_id": "envelope-a600",
      "authored_order": 0,
      "level_id": "level-0",
      "ring_vertex_ids": [
        "v-x0-y0",
        "v-x3072-y0",
        "v-x3840-y0",
        "v-x3840-y1152",
        "v-x3840-y3456",
        "v-x3840-y4032",
        "v-x3840-y5760",
        "v-x3072-y5760",
        "v-x0-y5760",
        "v-x0-y3456",
        "v-x0-y1728",
        "v-x0-y0"
      ],
      "area2_q16sq": 44236800
    }
  ],
  "plan_regions": [
    {
      "region_id": "region-bedroom",
      "authored_order": 0,
      "level_id": "level-0",
      "role": "space",
      "owner_ref": "space-bedroom",
      "ring_vertex_ids": [
        "v-x0-y0",
        "v-x3072-y0",
        "v-x3072-y1728",
        "v-x0-y1728",
        "v-x0-y0"
      ],
      "area2_q16sq": 10616832
    },
    {
      "region_id": "region-entry",
      "authored_order": 1,
      "level_id": "level-0",
      "role": "space",
      "owner_ref": "space-entry",
      "ring_vertex_ids": [
        "v-x3072-y0",
        "v-x3840-y0",
        "v-x3840-y1152",
        "v-x3072-y1152",
        "v-x3072-y0"
      ],
      "area2_q16sq": 1769472
    },
    {
      "region_id": "region-hall",
      "authored_order": 2,
      "level_id": "level-0",
      "role": "space",
      "owner_ref": "space-hall",
      "ring_vertex_ids": [
        "v-x3072-y1152",
        "v-x3840-y1152",
        "v-x3840-y3456",
        "v-x3072-y3456",
        "v-x3072-y1152"
      ],
      "area2_q16sq": 3538944
    },
    {
      "region_id": "region-kitchen",
      "authored_order": 3,
      "level_id": "level-0",
      "role": "space",
      "owner_ref": "space-kitchen",
      "ring_vertex_ids": [
        "v-x0-y1728",
        "v-x1792-y1728",
        "v-x1792-y3456",
        "v-x0-y3456",
        "v-x0-y1728"
      ],
      "area2_q16sq": 6193152
    },
    {
      "region_id": "region-bathroom",
      "authored_order": 4,
      "level_id": "level-0",
      "role": "space",
      "owner_ref": "space-bathroom",
      "ring_vertex_ids": [
        "v-x1792-y1728",
        "v-x3072-y1728",
        "v-x3072-y3456",
        "v-x1792-y3456",
        "v-x1792-y1728"
      ],
      "area2_q16sq": 4423680
    },
    {
      "region_id": "region-living",
      "authored_order": 5,
      "level_id": "level-0",
      "role": "space",
      "owner_ref": "space-living",
      "ring_vertex_ids": [
        "v-x0-y3456",
        "v-x3840-y3456",
        "v-x3840-y4032",
        "v-x3072-y4032",
        "v-x3072-y5760",
        "v-x0-y5760",
        "v-x0-y3456"
      ],
      "area2_q16sq": 15040512
    },
    {
      "region_id": "region-storage",
      "authored_order": 6,
      "level_id": "level-0",
      "role": "space",
      "owner_ref": "space-storage",
      "ring_vertex_ids": [
        "v-x3072-y4032",
        "v-x3840-y4032",
        "v-x3840-y5760",
        "v-x3072-y5760",
        "v-x3072-y4032"
      ],
      "area2_q16sq": 2654208
    }
  ],
  "spaces": [
    {
      "space_id": "space-bedroom",
      "authored_order": 0,
      "level_id": "level-0",
      "program_role": "bedroom",
      "region_ref": "region-bedroom",
      "adjacent_space_refs": [
        "space-hall"
      ],
      "outside_professional_scope": true,
      "area2_q16sq": 10616832
    },
    {
      "space_id": "space-entry",
      "authored_order": 1,
      "level_id": "level-0",
      "program_role": "entry",
      "region_ref": "region-entry",
      "adjacent_space_refs": [
        "space-hall"
      ],
      "outside_professional_scope": true,
      "area2_q16sq": 1769472
    },
    {
      "space_id": "space-hall",
      "authored_order": 2,
      "level_id": "level-0",
      "program_role": "circulation",
      "region_ref": "region-hall",
      "adjacent_space_refs": [
        "space-entry",
        "space-bedroom",
        "space-bathroom",
        "space-living"
      ],
      "outside_professional_scope": true,
      "area2_q16sq": 3538944
    },
    {
      "space_id": "space-kitchen",
      "authored_order": 3,
      "level_id": "level-0",
      "program_role": "kitchen",
      "region_ref": "region-kitchen",
      "adjacent_space_refs": [
        "space-living"
      ],
      "outside_professional_scope": true,
      "area2_q16sq": 6193152
    },
    {
      "space_id": "space-bathroom",
      "authored_order": 4,
      "level_id": "level-0",
      "program_role": "bathroom",
      "region_ref": "region-bathroom",
      "adjacent_space_refs": [
        "space-hall"
      ],
      "outside_professional_scope": true,
      "area2_q16sq": 4423680
    },
    {
      "space_id": "space-living",
      "authored_order": 5,
      "level_id": "level-0",
      "program_role": "living_dining",
      "region_ref": "region-living",
      "adjacent_space_refs": [
        "space-hall",
        "space-kitchen",
        "space-storage"
      ],
      "outside_professional_scope": true,
      "area2_q16sq": 15040512
    },
    {